{"acceptance":{"policy_mode":"enforce","required_checks":["x07_wasm_app_verify"]},"change_id":"lpcr_ww9j7szrrqexmr5qmsh54xrhkb","constraints":{"allow_unsafe":false,"max_risk_tier":"medium"},"created_unix_ms":1762147200000,"intent":"deploy","schema_version":"lp.change_request@0.1.0","target":{"app_id":"acme.payments.api","environment":{"kind":"staging"}}}