{
  "schema_version": "lp.change_request@0.1.0",
  "change_id": "lpcr_deploy_loop_app_min_staging",
  "created_unix_ms": 1762147200000,
  "target": {
    "app_id": "app_min",
    "environment": {
      "kind": "staging"
    }
  },
  "intent": "deploy",
  "acceptance": {
    "required_checks": [
      "x07_wasm_app_verify"
    ],
    "policy_mode": "enforce"
  },
  "constraints": {
    "allow_unsafe": false,
    "max_risk_tier": "medium"
  }
}
