{"acceptance":{"policy_mode":"enforce","required_checks":["x07_wasm_app_verify","x07_wasm_ops_validate"]},"change_id":"lpcr_f51dtrjzhhakeasbwsxt7qbfge","constraints":{"allow_unsafe":false,"max_risk_tier":"medium"},"created_unix_ms":1762147200000,"intent":"deploy","schema_version":"lp.change_request@0.1.0","target":{"app_id":"acme.payments.api.ops","environment":{"kind":"staging"}}}
